{
  "$schema": "http://json-schema.org/draft-07/schema#",
  "title": "Events Data",
  "type": "array",
  "minItems": 1,
  "items": {
    "type": "object",
    "additionalProperties": false,
    "required": [
      "id",
      "title",
      "dateTime",
      "location",
      "description"
    ],
    "properties": {
      "id": {
        "type": "string",
        "pattern": "^evt-[0-9]{3}$"
      },
      "title": {
        "type": "string",
        "minLength": 3
      },
      "dateTime": {
        "type": "string",
        "pattern": "^\\d{4}-\\d{2}-\\d{2}T\\d{2}:\\d{2}:\\d{2}$"
      },
      "location": {
        "type": "string",
        "minLength": 3
      },
      "description": {
        "type": "string",
        "minLength": 12
      }
    }
  }
}
